{
  "schemaVersion": 1,
  "periodo": "2026-07",
  "etiqueta": "Julio 2026",
  "moneda": "ARS",
  "variacionPct": 1.9,
  "fuente": {
    "url": "https://aaieric.org.ar/costos-mano-de-obra",
    "tipo": "pdf",
    "titulo": "AAIERIC - Costos Sugeridos de Mano de Obra - Julio 2026",
    "obtenidoEl": "2026-09-14"
  },
  "notas": [
    "Precios de mercado según encuesta a instaladores electricistas profesionales.",
    "Tarifas aplicables a CABA y GBA. Valores en AR$.",
    "Boca: caja rectangular, cuadrada u octogonal de medidas estándar con extensión máxima de cañería de 5 m entre sí. Para mayor extensión se cotiza 1 boca cada 5 m.",
    "Valores referenciales para instalaciones de 220/380 V residenciales y pequeños comercios hasta 10 kW.",
    "Sólo se puntean las cañerías para asegurarlas a la pared. Cerrado de canaletas y revoque final a cargo del gremio correspondiente.",
    "TODOS los materiales usados DEBEN ser certificados por la norma IRAM/IEC correspondiente.",
    "Precios para trabajos completos de instalación realizados por el mismo profesional: se debe sumar canalización en losa + mampostería + cableado + conexión + colocación de artefactos."
  ],
  "revisiones": [
    {
      "codigo": "bandejas.b200-300-metro-h-mayor3",
      "motivo": "El precio para H > 3 m (16897) es menor que el de H < 3 m (19733) en el PDF de origen. Transcripto tal cual; verificar contra el PDF."
    },
    {
      "codigo": "bandejas.b450-600-metro-h-mayor3",
      "motivo": "El precio para H > 3 m (23578) es menor que el de H < 3 m (26979) en el PDF de origen. Transcripto tal cual; verificar contra el PDF."
    },
    {
      "codigo": "bandejas.b450-600-accesorio-h-mayor3",
      "motivo": "El precio para H > 3 m (35234) es menor que el de H < 3 m (39424) en el PDF de origen. Transcripto tal cual; verificar contra el PDF."
    }
  ],
  "secciones": [
    {
      "codigo": "obra-general",
      "nombre": "Obra completa / Refacción / Ampliación",
      "orden": 1,
      "items": [
        {
          "codigo": "obra-general.visita",
          "descripcion": "Visita: inspección ocular, evaluación, diagnóstico, asesoramiento y presupuesto",
          "unidad": "unidad",
          "precio": 54310,
          "orden": 1
        },
        {
          "codigo": "obra-general.urgencia-nocturna",
          "descripcion": "Urgencia: lunes a sábado desde 20:00 hs / domingos y feriados (mínimo)",
          "unidad": "unidad",
          "precio": 130203,
          "orden": 2
        },
        {
          "codigo": "obra-general.boca-completa",
          "descripcion": "Boca completa (unidad básica de cotización de todo trabajo eléctrico)",
          "unidad": "boca",
          "precio": 108431,
          "orden": 3,
          "nota": "Canalización, amurado de cañería, cableado reglamentario, conexión de módulos y portalámparas de obra. No incluye instalación de artefactos."
        },
        {
          "codigo": "obra-general.service-instalacion-minimo",
          "descripcion": "Service / Instalación (mínimo)",
          "unidad": "unidad",
          "precio": 108431,
          "orden": 4
        },
        {
          "codigo": "obra-general.hora-trabajo-minimo",
          "descripcion": "Hora de trabajo (mínimo)",
          "unidad": "hora",
          "precio": 54310,
          "orden": 5
        },
        {
          "codigo": "obra-general.hora-trabajo-promedio",
          "descripcion": "Hora de trabajo (promedio)",
          "unidad": "hora",
          "precio": 54310,
          "orden": 6
        }
      ]
    },
    {
      "codigo": "canalizacion-losa",
      "nombre": "Canalización de cañería en losa",
      "orden": 2,
      "items": [
        {
          "codigo": "canalizacion-losa.losa-cano-metalico",
          "descripcion": "En losa con caño metálico",
          "unidad": "boca",
          "precio": 54894,
          "orden": 1
        },
        {
          "codigo": "canalizacion-losa.loseta-cano-metalico",
          "descripcion": "En loseta con caño metálico",
          "unidad": "boca",
          "precio": 57637,
          "orden": 2
        }
      ]
    },
    {
      "codigo": "amurado-mamposteria",
      "nombre": "Amurado de cañería en mampostería",
      "orden": 3,
      "items": [
        {
          "codigo": "amurado-mamposteria.ladrillo-comun-boca",
          "descripcion": "Ladrillo común",
          "unidad": "boca",
          "precio": 62382,
          "orden": 1
        },
        {
          "codigo": "amurado-mamposteria.ladrillo-hueco-boca",
          "descripcion": "Ladrillo hueco",
          "unidad": "boca",
          "precio": 60900,
          "orden": 2
        },
        {
          "codigo": "amurado-mamposteria.ladrillo-comun-metro",
          "descripcion": "Ladrillo común",
          "unidad": "metro",
          "precio": 14909,
          "orden": 3
        },
        {
          "codigo": "amurado-mamposteria.ladrillo-hueco-metro",
          "descripcion": "Ladrillo hueco",
          "unidad": "metro",
          "precio": 14618,
          "orden": 4
        }
      ]
    },
    {
      "codigo": "amurado-vista",
      "nombre": "Amurado de cañería a la vista",
      "orden": 4,
      "items": [
        {
          "codigo": "amurado-vista.metal-pvc-cablecanal",
          "descripcion": "Metal, PVC, cablecanal (14x30)",
          "unidad": "boca",
          "precio": 49861,
          "orden": 1
        }
      ]
    },
    {
      "codigo": "pase-viga-columna",
      "nombre": "Pase de viga y/o columna",
      "orden": 5,
      "items": [
        {
          "codigo": "pase-viga-columna.pase",
          "descripcion": "A razón de 1 (una) boca en viga y/o columna",
          "unidad": "boca",
          "precio": 57898,
          "orden": 1
        }
      ]
    },
    {
      "codigo": "cable-subterraneo",
      "nombre": "Cable subterráneo",
      "orden": 6,
      "items": [
        {
          "codigo": "cable-subterraneo.tramo-tierra",
          "descripcion": "Tramo en tierra (se cotiza 1 boca cada 1 m)",
          "unidad": "boca",
          "precio": 54260,
          "orden": 1
        },
        {
          "codigo": "cable-subterraneo.tramo-piso",
          "descripcion": "Tramo en piso (se cotiza 1 boca cada 1 m)",
          "unidad": "boca",
          "precio": 57898,
          "orden": 2
        },
        {
          "codigo": "cable-subterraneo.caja-paso-tierra",
          "descripcion": "Adicional por cada caja de paso — en tierra",
          "unidad": "unidad",
          "precio": 59587,
          "orden": 3
        },
        {
          "codigo": "cable-subterraneo.caja-paso-piso",
          "descripcion": "Adicional por cada caja de paso — en piso",
          "unidad": "unidad",
          "precio": 63628,
          "orden": 4
        }
      ]
    },
    {
      "codigo": "cableado",
      "nombre": "Cableado",
      "orden": 7,
      "items": [
        {
          "codigo": "cableado.obra-nueva-canalizacion-propia",
          "descripcion": "Obra nueva – Opción 1: canalización realizada por el profesional",
          "unidad": "boca",
          "precio": 26680,
          "orden": 1
        },
        {
          "codigo": "cableado.obra-nueva-canalizacion-terceros",
          "descripcion": "Obra nueva – Opción 2: canalización realizada por otro profesional",
          "unidad": "boca",
          "precio": 37149,
          "orden": 2
        },
        {
          "codigo": "cableado.recableado-con-artefactos",
          "descripcion": "Recableado con artefactos",
          "unidad": "boca",
          "precio": 55707,
          "orden": 3,
          "nota": "No incluye cables pegados a la cañería ni otro vicio oculto; se cotiza en el momento."
        },
        {
          "codigo": "cableado.recableado-sin-artefactos",
          "descripcion": "Recableado sin artefactos",
          "unidad": "boca",
          "precio": 37149,
          "orden": 4,
          "nota": "No incluye cables pegados a la cañería ni otro vicio oculto; se cotiza en el momento."
        }
      ]
    },
    {
      "codigo": "conexion-puntos-tomas",
      "nombre": "Conexión de puntos y tomas",
      "orden": 8,
      "items": [
        {
          "codigo": "conexion-puntos-tomas.punto-toma-simple",
          "descripcion": "Punto, toma simple, portalámpara",
          "unidad": "boca",
          "precio": 19363,
          "orden": 1
        },
        {
          "codigo": "conexion-puntos-tomas.toma-doble",
          "descripcion": "Toma doble",
          "unidad": "boca",
          "precio": 24525,
          "orden": 2
        },
        {
          "codigo": "conexion-puntos-tomas.punto-combinacion",
          "descripcion": "Punto combinación",
          "unidad": "boca",
          "precio": 20842,
          "orden": 3
        }
      ]
    },
    {
      "codigo": "acometida",
      "nombre": "Acometida (amurado + conexión)",
      "orden": 9,
      "items": [
        {
          "codigo": "acometida.gabinete-1-medidor-mono",
          "descripcion": "Gabinete 1 medidor monofásico",
          "unidad": "unidad",
          "precio": 227652,
          "orden": 1
        },
        {
          "codigo": "acometida.gabinete-2-medidores-mono",
          "descripcion": "Gabinete 2 medidores monofásicos",
          "unidad": "unidad",
          "precio": 325340,
          "orden": 2
        },
        {
          "codigo": "acometida.gabinete-3-medidores-mono",
          "descripcion": "Gabinete 3 medidores monofásicos",
          "unidad": "unidad",
          "precio": 758988,
          "orden": 3,
          "nota": "Incluye caja de toma 63 A (EDENOR/EDESUR)."
        },
        {
          "codigo": "acometida.gabinete-4-medidores-mono",
          "descripcion": "Gabinete 4 medidores monofásicos",
          "unidad": "unidad",
          "precio": 867405,
          "orden": 4,
          "nota": "Incluye caja de toma 63 A (EDENOR/EDESUR)."
        },
        {